{
  "schema_version": "2026-09-08.project-control-plane-v4",
  "methodology_version": "human-ai-project-v4",
  "updated_at": "2026-09-15T12:28:00+08:00",
  "project": {
    "name": "marketing-workbench-v2",
    "path": "/Users/hys/Projects/marketing-workbench-v2",
    "type": "local_marketing_agent_workbench_v2",
    "lifecycle": "active",
    "capabilities_version": "workflow-case-v1"
  },
  "active_task": null,
  "last_closed_task_ref": "tasks/TASK-MWBV2-APPEND-RATE-LIMIT-RECOVERY-20260915.md",
  "guardrails": {
    "platform_write_allowed": false,
    "workbench_runtime_write_policy": {
      "enabled": true,
      "mode": "authenticated_lan_plan_bound_confirmation_only",
      "origin": "configured:WORKBENCH_PUBLIC_ORIGIN",
      "require_authenticated_owner": true,
      "allowed_source_usage": [
        "runtime_truth"
      ],
      "allowed_plan_kinds": [
        "monitor_bootstrap",
        "resource_prepare",
        "std_project_create",
        "project_video_append",
        "project_video_material_push"
      ],
      "require_active_case": true,
      "require_latest_case_job": true,
      "require_exact_plan_binding": true,
      "require_exact_confirmation_phrase": true,
      "maximum_confirmations_per_plan": 1,
      "retry_allowed": false
    },
    "platform_write_scope": {
      "binding_mode": "single_confirmation_plan",
      "action_grants": {},
      "retry_allowed": false,
      "target_job_id": "JOB-MWBV2-20260831092159-D13FDB",
      "target_plan_id": "PLAN-JOB-MWBV2-20260831092159-D13FDB-V3",
      "allowed_actions": [],
      "maximum_actions": 0,
      "target_draft_id": "",
      "target_plan_hash": "sha256:61be67cf3a057f56a28b14dcdd52a3a6743c8f0ae8824927ca3fb74d98144cbe",
      "target_attempt_no": 1,
      "target_payload_hash": "",
      "allowed_plan_actions": [],
      "maximum_create_calls": 0,
      "target_advertiser_id": "1871922414575753",
      "maximum_total_attempts": 1,
      "granted_by_task_id": "TASK-MWBV2-CASE-5B75-EVENT-RESOURCE-PLAN-20260901",
      "granted_at": "2026-09-01T12:45:00+08:00",
      "revoked_at": "2026-09-01T12:52:00+08:00",
      "revocation_reason": "resource_plan_blocked_before_platform_write:credential_required",
      "maximum_platform_calls": 0
    },
    "credential_refresh_allowed": true,
    "credential_refresh_scope": {
      "mode": "scheduled_daily_oauth_refresh_only",
      "authorized_automation_id": "oceanengine-v2-token-refresh",
      "timezone": "Asia/Shanghai",
      "daily_at": "12:01",
      "confirm_variable": "MWBV2_OE_TOKEN_REFRESH_CONFIRM=REFRESH_ONE_OCEANENGINE_TOKEN",
      "allowed_actions": [
        "oceanengine_oauth_refresh_token"
      ],
      "forbidden_actions": [
        "std_project/create",
        "material upload",
        "event asset create",
        "DMP push",
        "budget or bid update"
      ],
      "granted_at": "2026-08-28 CST",
      "granted_by": "user_confirmed_oauth_refresh_recovery"
    },
    "budget_bid_change_allowed": false,
    "long_term_lesson_write_allowed": false,
    "git_history_rewrite_allowed": false,
    "external_asset_move_allowed": false,
    "real_platform_dependency_allowed": true,
    "existing_deletion_handling_allowed": true,
    "do_not_start": [
      "未经项目全局允许和当前 job 授权的真实平台写入",
      "Promotion 创建或重试",
      "监测链接组创建",
      "预算或出价修改",
      "未获独立授权的 OAuth token 刷新",
      "把 token、Cookie、secret、auth_code 或完整触点 URL 写入项目文件",
      "直接依赖旧项目路径作为 v2 运行时真值",
      "未建立任务卡和 context manifest 时推进跨阶段开发"
    ],
    "last_event_asset_write_grant": {
      "task_id": "TASK-MWBV2-OE3-JSZC-EVENT-ASSET-API-CREATE-1871922434025472-20260830",
      "job_id": "JOB-MWBV2-20260830140153-667873",
      "advertiser_id": "1871922434025472",
      "plan_id": "PLAN-JOB-MWBV2-20260830140153-667873-V2",
      "plan_hash": "sha256:1b491dc867ce162cf2b1045c4d8ef3f77fde6dcf0d47796891433be750c52376",
      "allowed_actions": [
        "ensure_resource:event_asset"
      ],
      "maximum_platform_calls": 1,
      "retry_allowed": false
    },
    "last_event_configs_write_grant": {
      "task_id": "TASK-MWBV2-OE3-JSZC-EVENT-CONFIGS-CREATE-1871922434025472-20260830",
      "job_id": "JOB-MWBV2-20260830140153-667873",
      "advertiser_id": "1871922434025472",
      "plan_id": "PLAN-JOB-MWBV2-20260830140153-667873-V8",
      "plan_hash": "sha256:0ec98922195eba2b4fca8971251e7520c043097ec2cb5fba938cf96fcc7b741b",
      "allowed_actions": [
        "ensure_event_configs:baseline"
      ],
      "maximum_platform_calls": 6,
      "retry_allowed": false
    }
  }
}
